{
  "$schema": "../scenario.schema.json",
  "format": "skillum.sim-scenario",
  "version": 1,
  "meta": {
    "title": "Регистрация входящего письма",
    "task": "Зарегистрируйте входящее письмо от ООО «Ромашка» с номером ВХ-1183 и темой «Запрос коммерческого предложения», исполнитель — Петрова.",
    "language": "ru",
    "system": "СЭД",
    "createdAt": "2026-10-06T12:00:00Z",
    "tool": {
      "name": "Skill'Ум",
      "version": "2.40.0"
    }
  },
  "settings": {
    "stage": {
      "w": 1920,
      "h": 1200
    },
    "normSeconds": 150,
    "limitSeconds": 300,
    "minViewportWidth": 1280,
    "hints": {
      "enabled": true,
      "afterMisses": 3
    },
    "counters": {
      "actions": false,
      "misses": false,
      "detours": false
    }
  },
  "media": [
    {
      "id": "home",
      "file": "media/home.png",
      "w": 1920,
      "h": 1200
    },
    {
      "id": "outgoing",
      "file": "media/outgoing.png",
      "w": 1920,
      "h": 1200
    },
    {
      "id": "list",
      "file": "media/list.png",
      "w": 1920,
      "h": 1200
    },
    {
      "id": "form",
      "file": "media/form.png",
      "w": 1920,
      "h": 1200
    },
    {
      "id": "done",
      "file": "media/done.png",
      "w": 1920,
      "h": 1200
    },
    {
      "id": "deleted",
      "file": "media/deleted.png",
      "w": 1920,
      "h": 1200
    },
    {
      "id": "file-menu",
      "file": "media/file-menu.png",
      "w": 402,
      "h": 276
    },
    {
      "id": "delete-dialog",
      "file": "media/delete-dialog.png",
      "w": 728,
      "h": 408
    },
    {
      "id": "dir-dialog",
      "file": "media/dir-dialog.png",
      "w": 1920,
      "h": 1200
    },
    {
      "id": "exec-list",
      "file": "media/exec-list.png",
      "w": 960,
      "h": 288
    },
    {
      "id": "confirm-dialog",
      "file": "media/confirm-dialog.png",
      "w": 1920,
      "h": 1200
    },
    {
      "id": "save-error",
      "file": "media/save-error.png",
      "w": 728,
      "h": 72
    }
  ],
  "fields": [
    {
      "id": "corr",
      "title": "корреспондент",
      "fill": "effect",
      "check": {
        "answerKind": "text",
        "join": "any",
        "rules": [
          {
            "kind": "text",
            "match": "wildcard",
            "value": "ООО «Ромашка»"
          }
        ]
      }
    },
    {
      "id": "num",
      "title": "рег. номер",
      "fill": "keyboard",
      "checkWhen": "input",
      "tabIndex": 1,
      "check": {
        "answerKind": "text",
        "join": "any",
        "rules": [
          {
            "kind": "text",
            "match": "regex",
            "value": "^вх[-\\s]?1183$"
          }
        ]
      },
      "hint": "Номер указан в задании. Ввод подтверждается клавишей Enter"
    },
    {
      "id": "topic",
      "title": "тема",
      "fill": "keyboard",
      "checkWhen": "input",
      "tabIndex": 2,
      "check": {
        "answerKind": "text",
        "join": "any",
        "rules": [
          {
            "kind": "text",
            "match": "wildcard",
            "value": "Запрос коммерческого предложения"
          }
        ]
      },
      "hint": "Тема указана в задании. Ввод подтверждается клавишей Enter"
    },
    {
      "id": "exec",
      "title": "исполнитель",
      "fill": "effect",
      "check": {
        "answerKind": "text",
        "join": "any",
        "rules": [
          {
            "kind": "text",
            "match": "wildcard",
            "value": "Петрова А. В."
          }
        ]
      }
    }
  ],
  "start": "home",
  "scenes": [
    {
      "id": "home",
      "title": "Рабочий стол",
      "elements": [
        {
          "id": "bg",
          "media": "home",
          "x": 0,
          "y": 0
        }
      ],
      "zones": [
        {
          "id": "home-inbox",
          "x": 0,
          "y": 336,
          "w": 346,
          "h": 60,
          "role": "path",
          "effects": [
            {
              "goto": "list"
            }
          ],
          "hint": "Входящие документы — в меню слева"
        },
        {
          "id": "home-outgoing",
          "x": 0,
          "y": 408,
          "w": 346,
          "h": 60,
          "role": "detour",
          "effects": [
            {
              "goto": "outgoing"
            }
          ]
        },
        {
          "id": "home-cards",
          "x": 403,
          "y": 264,
          "w": 1478,
          "h": 240,
          "role": "neutral"
        }
      ]
    },
    {
      "id": "outgoing",
      "title": "Исходящие",
      "elements": [
        {
          "id": "bg",
          "media": "outgoing",
          "x": 0,
          "y": 0
        }
      ],
      "zones": [
        {
          "id": "out-inbox",
          "x": 0,
          "y": 336,
          "w": 346,
          "h": 60,
          "role": "path",
          "effects": [
            {
              "goto": "list"
            }
          ],
          "hint": "Входящие документы — в меню слева"
        },
        {
          "id": "out-home",
          "x": 0,
          "y": 264,
          "w": 346,
          "h": 60,
          "role": "detour",
          "effects": [
            {
              "goto": "home"
            }
          ]
        }
      ]
    },
    {
      "id": "list",
      "title": "Входящие",
      "elements": [
        {
          "id": "bg",
          "media": "list",
          "x": 0,
          "y": 0
        }
      ],
      "zones": [
        {
          "id": "list-create",
          "x": 29,
          "y": 150,
          "w": 211,
          "h": 60,
          "role": "path",
          "effects": [
            {
              "goto": "form"
            }
          ],
          "hint": "Новый документ создаётся кнопкой «+ Создать» на панели инструментов"
        },
        {
          "id": "list-new",
          "x": 38,
          "y": 1080,
          "w": 269,
          "h": 72,
          "role": "alt",
          "effects": [
            {
              "goto": "form"
            }
          ]
        },
        {
          "id": "list-file",
          "x": 19,
          "y": 72,
          "w": 96,
          "h": 60,
          "role": "alt",
          "effects": [
            {
              "goto": "list-menu"
            }
          ]
        },
        {
          "id": "list-delete",
          "x": 470,
          "y": 150,
          "w": 192,
          "h": 60,
          "role": "detour",
          "effects": [
            {
              "goto": "list-delete"
            }
          ]
        },
        {
          "id": "list-home",
          "x": 0,
          "y": 264,
          "w": 346,
          "h": 60,
          "role": "detour",
          "effects": [
            {
              "goto": "home"
            }
          ]
        },
        {
          "id": "list-outgoing",
          "x": 0,
          "y": 408,
          "w": 346,
          "h": 60,
          "role": "detour",
          "effects": [
            {
              "goto": "outgoing"
            }
          ]
        },
        {
          "id": "list-copy-number",
          "x": 384,
          "y": 336,
          "w": 134,
          "h": 60,
          "role": "neutral",
          "copyText": "ВХ-1182"
        },
        {
          "id": "list-table",
          "x": 365,
          "y": 252,
          "w": 1517,
          "h": 492,
          "role": "neutral"
        }
      ]
    },
    {
      "id": "list-menu",
      "title": "Входящие · меню «Файл»",
      "elements": [
        {
          "id": "bg",
          "media": "list",
          "x": 0,
          "y": 0
        },
        {
          "id": "menu",
          "media": "file-menu",
          "x": 19,
          "y": 132,
          "w": 403,
          "h": 276
        }
      ],
      "onMissGoto": "list",
      "keys": [
        {
          "id": "list-menu-esc",
          "keys": "Escape",
          "role": "detour",
          "effects": [
            {
              "goto": "list"
            }
          ]
        }
      ],
      "zones": [
        {
          "id": "menu-create",
          "x": 29,
          "y": 138,
          "w": 384,
          "h": 60,
          "role": "alt",
          "effects": [
            {
              "goto": "form"
            }
          ],
          "hint": "Пункт «Создать входящий»"
        },
        {
          "id": "menu-other",
          "x": 29,
          "y": 204,
          "w": 384,
          "h": 192,
          "role": "detour",
          "effects": [
            {
              "goto": "list"
            }
          ]
        }
      ]
    },
    {
      "id": "list-delete",
      "title": "Входящие · удалить документ?",
      "elements": [
        {
          "id": "bg",
          "media": "list",
          "x": 0,
          "y": 0
        },
        {
          "id": "dialog",
          "media": "delete-dialog",
          "x": 595,
          "y": 360,
          "w": 730,
          "h": 408,
          "appear": {
            "mode": "after-previous",
            "effect": "fade",
            "durationMs": 150
          }
        }
      ],
      "keys": [
        {
          "id": "list-delete-esc",
          "keys": "Escape",
          "role": "detour",
          "effects": [
            {
              "goto": "list"
            }
          ]
        }
      ],
      "zones": [
        {
          "id": "delete-yes",
          "x": 826,
          "y": 648,
          "w": 288,
          "h": 84,
          "role": "trap",
          "effects": [
            {
              "goto": "deleted"
            }
          ],
          "error": "Удалил чужой документ вместо создания нового"
        },
        {
          "id": "delete-no",
          "x": 1133,
          "y": 648,
          "w": 154,
          "h": 84,
          "role": "detour",
          "effects": [
            {
              "goto": "list"
            }